Не знаю как остальные, но я встретил здесь понимание
Прежде чем отвезти свою дочь с диагнозом родовая краниоспинальная травма в 18 психоневрологическую больницу прочитал отзывы на этом сайте. Возникли сомнения: а стоит ли? Комментарии некоторых посетителей сайта по поводу не налаженности бытовых условий и уровня персонала навеяли мысли о том, чтобы определить ребенка в более приличное место. Однако не смотря на все сомнения мы решились на госпитализацию. В конце концов при желании всегда можно сменить больницу, если что-то будет не устраивать. Итак:
1. Начну с малого, но очень показательного факта - при входе в больницу вам выдают бахилы бесплатно. Казалось бы мелочь, но мелочь показательная. К вам относятся по-человечески и не требуют с вас мзду за то, чтобы вы имели возможность пройти по больничному коридору;
2. В коридорах чисто, ничем не пахнет, хороший ремонт;
3. Врачи готовы давать ответы на имеющиеся у вас вопросы, находятся в курсе ситуации больного;
4. Детей на лечении не много, в третьем отделении (куда мы поступили) практически у каждой мамы с ребенком отдельная палата. Т. е. риск заразиться чем-либо от других детей минимален;
5. Уровень квалификации врачей лично у меня не вызывает сомнения, тем более, что учреждение профильное и находится в структуре Департамента здравоохранения г. Москвы.
Не знаю как остальные, но я встретил здесь понимание.
