Антисанитария, нечеловеческий подход
Отзыв о Химкинском детском инфекционном отделении
Лежали с сыном осенью 2014 г.
Легли планово, т. к. по анализам были постоянные инфекции, нам предложил врач в детской гос. поликлинике на Мельникова лечь полечиться. В этом детском инфекционном отделении г. Химки на Rуркинском шоссе есть коридор с 1 местн. палатами – (в боксе только 2 койки и тумба) и есть коридор с боксами (там есть 1 кровать, стол, табурет, тумба, металлическая кровать для новорожден). Нет никакого шкафа для вещей, крючков, куда можно повесить вещи, полотенце. При поступлении постель была поменяна, полы без средства вымыты, туалет с ванной грязные, был запах хлорки для видимости, душка от унитаза вся залитая мочой, плюс был кал на унитазе от прошлых инфекционных больных.
И это инфекционное отделение, где для вновь поступивших должны были отдраить все, дабы они не подцепили чего, тем более у нас был ребенок 2, 5 лет, который лез везде, ползал и сидел по всем полам.
Перед поступлением нам врач предварительно сказал, какими препаратами нас будет лечить, я, естественно, прочитала об этих препаратах, вроде бы норма. Когда пришли ложиться нам предложил врач (у нас был мужчина) совсем др. препараты, в т. ч. левомицетин (сказал, что оч. хороший препарат). На тот момент я не знала, что это оч. токсичный препарат и вызывает необратимые изменения в костном мозге. Он меня тогда заверил, да не переживайте, препарат оч. хороший, мы им даже новорожденных лечим, хорошо переносится. Назначил нам анализы ОАК, ОАМ и все. (никакой биохимии не назначил, хотя мы были сердечники, он об этом знал, и у нас биохимия была предыдущая не очень хорошая, но на контроль эти показатели не взял!).
Сказал, что ничего лишнего мы не можем назначить, у нас за все отчет, все это деньги.
Минусы: в первые 2 дня врач на обходе к нам не приходил, пока я сама не вышла и не пошла напоминать о себе, потом заходил. Полы нам не мыли (пока я опять же не пошла сама и не вытребовала, на, что мне ответили «вы, что дома у себя тоже полы не моете?», хотя в отделении уборщица присутствует, у кого то мыла ходила, уборщица мне ответила «у меня 2 этажа, я не могу на всех разорваться», пардон, а вы когда устраивались, вы, что не знали, какой объем работы вам выполнять, т. е. зарплату за 2 этажа вы хотите получать, а работать мы не хотим). И это инфекционное отделение, где все должно мыться со средствами, она потом через день приходила к нам мыть без средства без всего, унитаз сверху сухой тряпочкой для видимости протирают. Т. е. вся инфекция сидит тут же. К уборщице как ни подойдешь, так все сидят в кабинетике чаек пьют, некогда им, контроля на них совсем нет, руководство нужно уволить такое, которое не следит за своими сотрудниками.
Вот остались 2 дня до выписки, мы ждем радостно этих дней и тут ночью у ребенка начался жуткий понос, просто вода лилась, вся постель залита от и до, ходила менять постель за ночь несколько раз. На матрасах оказывается нет клеенки (один пароллон), он все в себя впитывает, представляете какая там зараза стоит от всех предыдущих пациентов!? Т. е. на кровати этот пароллон и сверху простынь.
Это было Вс, был приходящий подрабатывающий дежурный врач, женщина советских времен, видимо уже на пенсии, она уже проснулась, было где-то 8 ч, пили с мед. персоналом чаек, я пришла с ребенком, которому совсем не хорошо, сказала, что ребенку плохо, подойдите, пожалуйста, она даже не встала, а сказала «вот придет скоро ваш лечащий врач и посмотрит». Это разве врач, это просто изверг, да таких гнать надо поганой метлой из лечебных учреждений, ребенку плохо, а ей пофиг! Ребенка начало рвать, поднялась температура под 40. Вот легли, называется, пролечились – подцепили ротавирус. Хотя обеззараживатель у нас в комнате работал круглые сутки! Вопрос- какой толк от него!?
Легли мы с ротавирусом (на тот момент я еще не знала, что мы там подцепили, т. к. такое было впервые) в клинику здоровья детей РАМН, там нас выходили.
Еще такой момент, про питание – питание хорошее было осенью, прям вкусно и на отвал, НО в супе 1 раз у меня плавал таракан (как раз за 2-3 дня до ротавируса), я сказала, что буду жаловаться в СЭС, прибежали руководители с кухни, просили, чтобы никуда не писала, я согласилась, с условием, что они будут контролировать все (чистоту…). До этого приходили буфетчицы, развозили еду, везут они ее с улицы, с общей кухни, где-то открывают двери, кнопки лифта нажимают, потом везут еде детям – хлеб, йогурты подают этой грязной рукой! Меня это шокировало, т. к. даже в магазине продавец одевает мешочек на руку. И это инфекционное отделение! Я об этом сказала главному по кухне, на след. день буфетчицы были в чепчиках и подавали хлеб мешочком, НО только они отъезжали от моей палаты, снимали мешочек с руки и всем остальным подавали своей грязной лапой. Это разве люди!?
Вывод, возможно врачи неплохие, но сан. условия не соблюдаются – это касается уборки и дезинфекции сан узлов, на матрасах нет клеенки, голый поролон и простынь сверху,
Приходила ко мне зав. отделением по поводу мы
