name	url
ЦЕНТР ДИАГНОСТИКИ И ЛЕЧЕНИЯ СЕМАШКО, вызов врача на дом, офтальмолог, УЗИ, колоноскопия	http://www.spr.ru/hamovniki/detskiy-tsentr-diagnostiki-i-lecheniya-imeni-n-a-semashko.html
ФЭНТЕЗИ, детская клиника, отличные педиатры и другие детские врачи в ЮЗАО	http://www.spr.ru/lomonosovskiy/fentezi-4671124.html
ОКЕАН ЗДОРОВЬЯ, детский медицинский центр	http://www.spr.ru/balashiha-i-gorodskoy-okrug-balashiha/okean-zdorovya-1183590.html
ДЕТСКИЙ ДИАГНОСТИЧЕСКИЙ ЦЕНТР	http://www.spr.ru/domodedovo-i-gorodskoy-okrug-domodedovo/detskiy-diagnosticheskiy-tsentr-1118380.html
МАШЕНЬКА, детский медицинский центр	http://www.spr.ru/lyubertsi-i-lyuberetskiy-rayon/mashenka-4651361.html
ИНСТИТУТ ДЕТСКОЙ НЕВРОЛОГИИ И ЭПИЛЕПСИИ ИМЕНИ СВЯТИТЕЛЯ ЛУКИ	http://www.spr.ru/troitsk/institut-detskoy-nevrologii-i-epilepsii-imeni-svyatitelya-luki.html
ТИГРЁНОК, детский медицинский центр	http://www.spr.ru/izmaylovo/tigrenok-1020530.html
МАРКУШКА, детская поликлиника, стоматология	http://www.spr.ru/balashiha-i-gorodskoy-okrug-balashiha/markushka-4577345.html
ЛЬВЁНОК, детский медицинский центр	http://www.spr.ru/lyubertsi-i-lyuberetskiy-rayon/lvenok-4609322.html
ПЕДИАТР И Я, детский медицинский центр	http://www.spr.ru/severnoe-butovo/pediatr-i-ya-4660658.html
СМ-ДОКТОР, детский медицинский центр	http://www.spr.ru/koptevo/sm-doktor.html
МОСКОВСКИЙ ОБЛАСТНОЙ КОНСУЛЬТАТИВНО-ДИАГНОСТИЧЕСКИЙ ЦЕНТР ДЛЯ ДЕТЕЙ	http://www.spr.ru/danilovskiy/moskovskiy-oblastnoy-konsultativno-diagnosticheskiy-tsentr-dlya-detey.html
НАУЧНЫЙ ЦЕНТР ЗДОРОВЬЯ ДЕТЕЙ РАМН	http://www.spr.ru/gagarinskiy/nauchniy-tsentr-zdorovya-detey-ramn.html
СОЛНЫШКО, детский медицинский центр	http://www.spr.ru/voskresensk-i-voskresenskiy-rayon/solnishko-1001262.html
ВИТАМИНКА, детский медицинский центр	http://www.spr.ru/balashiha-i-gorodskoy-okrug-balashiha/vitaminka-4379623.html
МЕДИАРТ, детский медицинский центр	http://www.spr.ru/novo-peredelkino/mediart-962074.html
АВТОР-МЕД, детская клиника	http://www.spr.ru/tepliy-stan/avtor-med.html
АЙБОЛИТ, детский медицинский центр	http://www.spr.ru/dolgoprudniy-i-gorodskoy-okrug-dolgoprudniy/aybolit-4626129.html
НЕБОЛЕЙКА, детский медицинский центр	http://www.spr.ru/mitischi-i-mitischinskiy-rayon/neboleyka-4261444.html
ЦЕНТР ВОССТАНОВИТЕЛЬНОГО ЛЕЧЕНИЯ ДЕТЕЙ С БРОНХОЛЁГОЧНОЙ ПАТОЛОГИЕЙ	http://www.spr.ru/horoshevskiy/tsentr-vosstanovitelnogo-lecheniya-detey-s-bronholegochnoy-patologiey.html
ВАШ ДОКТОР, центр детского здоровья	http://www.spr.ru/balashiha-i-gorodskoy-okrug-balashiha/vash-doktor-1158992.html
ЗАБОТЛИВЫЙ ДОКТОР, детский медицинский центр	http://www.spr.ru/cheremushki/zabotliviy-doktor.html
ДОКТОР ЦАРЁВ	http://www.spr.ru/basmanniy/doktor-tsarev.html
САРХАНН В.С., врач уролог-андролог	http://www.spr.ru/basmanniy/sarhann-v-s.html
ЗДОРОВОЕ ПОКОЛЕНИЕ, детский медицинский центр	http://www.spr.ru/vidnoe-i-leninskiy-rayon/zdorovoe-pokolenie-4073213.html
МЕДИАРТ, детская клиника	http://www.spr.ru/novo-peredelkino/mediart-4266692.html
МЕДКВАДРАТ, детский медицинский центр	http://www.spr.ru/troparevo-nikulino/medkvadrat-4124351.html
SANTE, детский медицинский центр	http://www.spr.ru/ramenskoe-i-ramenskiy-rayon/sante-1710385.html
НАШИ ДЕТИ, детский медицинский центр	http://www.spr.ru/vihino-zhulebino/nashi-deti.html
НМХЦ ИМ. Н.И. ПИРОГОВА, детский консультативно-диагностический центр	http://www.spr.ru/tverskoy/nmhts-im-n-i-pirogova.html
СТАРНАКО-ЛОР, детский медицинский центр	http://www.spr.ru/altufevskiy/starnako-lor.html
ДЕТСКИЙ ЛОР	http://www.spr.ru/ramenskoe-i-ramenskiy-rayon/detskiy-lor.html
ЗДОРОВЬЕ ЧЕЛОВЕКА, детский медицинский центр	http://www.spr.ru/otradnoe/zdorove-cheloveka-945203.html
КЛИНИКА ДОКТОРА ШАТАЛОВА № 5	http://www.spr.ru/elektrogorsk-i-gorodskoy-okrug-elektrogorsk/klinika-doktora-shatalova-5.html
ДЕТСКИЙ НЕВРОЛОГИЧЕСКИЙ ЦЕНТР	http://www.spr.ru/severnoe-medvedkovo/detskiy-nevrologicheskiy-tsentr.html
ДОБРЫЙ ДОКТОР, детская клиника	http://www.spr.ru/dolgoprudniy-i-gorodskoy-okrug-dolgoprudniy/dobriy-doktor-4137399.html
МЕДИЦИНСКИЙ ЦЕНТР В КОЛОМЕНСКОМ, детская клиника	http://www.spr.ru/nagatinskiy-zaton/meditsinskiy-tsentr-v-kolomenskom.html
САМОЛЁТ, детская клиника	http://www.spr.ru/chertanovo-yuzhnoe/samolet-4656703.html
KIDS CMD, детская клиника	http://www.spr.ru/novokosino/kids-cmd.html
АВИЦЕННА, детский медицинский центр	http://www.spr.ru/mitischi-i-mitischinskiy-rayon/avitsenna-4590985.html
АИСТЁНОК, детский медицинский центр	http://www.spr.ru/lyubertsi-i-lyuberetskiy-rayon/aistenok-1126255.html
ЗДОРОВАЯ СЕМЬЯ, профессорская педиатрическая клиника	http://www.spr.ru/golovinskiy/zdorovaya-semya-4609869.html
КОЛОМНА, реабилитационный центр для детей с ограниченными возможностями	http://www.spr.ru/kolomna-i-kolomenskiy-rayon/kolomna-80420.html
ПОЛЛИАННА, детский медицинский центр	http://www.spr.ru/mitischi-i-mitischinskiy-rayon/pollianna.html
ДОКТОР ЖУЛЕБИН, детский медицинский центр	http://www.spr.ru/vihino-zhulebino/doktor-zhulebin.html
НАШ ПЕДИАТР, детская клиника	http://www.spr.ru/obruchevskiy/nash-pediatr.html
ЦЕНТР ВОССТАНОВИТЕЛЬНОГО ЛЕЧЕНИЯ ДЕТЕЙ № 9	http://www.spr.ru/akademicheskiy/tsentr-vosstanovitelnogo-lecheniya-detey-9.html
ЦЕНТР ЕСТЕСТВЕННОГО РАЗВИТИЯ И ЗДОРОВЬЯ РЕБЁНКА, детский медицинский центр	http://www.spr.ru/danilovskiy/tsentr-estestvennogo-razvitiya-i-zdorovya-rebenka.html
ЧАСТНАЯ ДЕТСКАЯ КЛИНИКА	http://www.spr.ru/aeroport/chastnaya-detskaya-klinika.html
АЛЁНУШКА, Егорьевский реабилитационный центр для детей и подростков с ограниченными возможностями	http://www.spr.ru/egorevsk-i-egorevskiy-rayon/alenushka-991224.html
ДЕТСКИЙ ДОКТОР, детский медицинский центр	http://www.spr.ru/obruchevskiy/detskiy-doktor.html
ДЕТСКИЙ ЦЕНТР ПСИХОЛОГО-МЕДИКО-СОЦИАЛЬНОГО СОПРОВОЖДЕНИЯ	http://www.spr.ru/bibirevo/detskiy-tsentr-psihologo-mediko-sotsialnogo-soprovozhdeniya.html
ЕГОРКА, Егорьевский реабилитационный центр для детей и подростков с ограниченными возможностями	http://www.spr.ru/egorevsk-i-egorevskiy-rayon/egorka-991226.html
ЗДОРОВОЕ ПОКОЛЕНИЕ, детский медицинский центр	http://www.spr.ru/zhukovskiy-i-gorodskoy-okrug-zhukovskiy/zdorovoe-pokolenie-4387940.html
КИНДЕР-МЕД, детский медицинский центр	http://www.spr.ru/himki-i-gorodskoy-okrug-himki/kinder-med.html
МЕДКОМ, детский медицинский центр	http://www.spr.ru/rostokino/medkom.html
ОН КЛИНИК БЕЙБИ, детский медицинский центр	http://www.spr.ru/taganskiy/on-klinik-beybi.html
ОПТИМИСТ, реабилитационный центр для детей и подростков с ограниченными возможностями	http://www.spr.ru/sergiev-posad-i-sergievo-posadskiy-rayon/optimist-212573.html
ОРТОМЕДЦЕНТР, детский консультативно-ортопедический центр	http://www.spr.ru/preobrazhenskoe/ortomedtsentr.html
ПОЛЛИАННА, педиатрическая практика	http://www.spr.ru/korolev-i-gorodskoy-okrug-korolev/pollianna-4695992.html
САНАРЕ, детский медицинский центр	http://www.spr.ru/bogorodskoe/sanare.html
СЕМЬЯ И ЗДОРОВЬЕ, детский многопрофильный медицинский центр	http://www.spr.ru/hamovniki/semya-i-zdorove.html
СМ-ДОКТОР, детский медицинский центр	http://www.spr.ru/kuntsevo/sm-doktor-4665411.html
ЦЕНТР ВОССТАНОВИТЕЛЬНОГО ЛЕЧЕНИЯ ДЛЯ ДЕТЕЙ № 4	http://www.spr.ru/presnenskiy/tsentr-vosstanovitelnogo-lecheniya-dlya-detey-4.html
MEDSWISS ДЕТЯМ, детский медицинский центр	http://www.spr.ru/tepliy-stan/medswiss-detyam.html
ВАШ ДЕТСКИЙ ДОКТОР	http://www.spr.ru/butirskiy/vash-detskiy-doktor.html
ДЕТСКИЙ МЕДИЦИНСКИЙ ЦЕНТР	http://www.spr.ru/presnenskiy/detskiy-meditsinskiy-tsentr.html
ДЕТСКИЙ НЕЙРОПСИХОЛОГИЧЕСКИЙ ЦЕНТР	http://www.spr.ru/kurkino/detskiy-neyropsihologicheskiy-tsentr.html
ДЕТСКИЙ РЕАБИЛИТАЦИОННЫЙ ЦЕНТР	http://www.spr.ru/meschanskiy/detskiy-reabilitatsionniy-tsentr-1130808.html
ИНСТИТУТ ДЕТСКОЙ НЕВРОЛОГИИ И ЭПИЛЕПСИИ ИМ. СВЯТИТЕЛЯ ЛУКИ	http://www.spr.ru/moskvoreche-saburovo/institut-detskoy-nevrologii-i-epilepsii-im-svyatitelya-luki-4712928.html
ЛЕСНЫЕ ПОЛЯНЫ, детский реабилитационный центр	http://www.spr.ru/podolsk-i-podolskiy-rayon/lesnie-polyani-4522085.html
МАСТЕРСКАЯ ЗДОРОВЬЯ, медицинская клиника	http://www.spr.ru/danilovskiy/masterskaya-zdorovya-4669306.html
НА ТАГАНКЕ, детский центр психолого-педагогической реабилитации и коррекции	http://www.spr.ru/taganskiy/na-taganke-113417.html
РЕАБИЛИТАЦИОННЫЙ ЦЕНТР ДЛЯ ДЕТЕЙ И ПОДРОСТКОВ С ОГРАНИЧЕННЫМИ ВОЗМОЖНОСТЯМИ	http://www.spr.ru/protvino-i-gorodskoy-okrug-protvino/reabilitatsionniy-tsentr-dlya-detey-i-podrostkov-s-ogranichennimi.html
РЭМСИ ДИАГНОСТИКА, диагностический центр	http://www.spr.ru/tverskoy/remsi-diagnostika-4670500.html
СЕМЕЙНЫЙ ДОКТОР, детская клиника	http://www.spr.ru/hamovniki/semeyniy-doktor-4710701.html
СЕМЬЯ И ЗДОРОВЬЕ, детский медицинский центр	http://www.spr.ru/himki-i-gorodskoy-okrug-himki/semya-i-zdorove-4811169.html
СМ-ДОКТОР, детский медицинский центр	http://www.spr.ru/pechatniki/sm-doktor-4665412.html
ЦЕНТР ВОССТАНОВИТЕЛЬНОГО ЛЕЧЕНИЯ ДЕТЕЙ № 6	http://www.spr.ru/tverskoy/tsentr-vosstanovitelnogo-lecheniya-detey-6.html
ЦЕНТР ВОССТАНОВИТЕЛЬНОГО ЛЕЧЕНИЯ ДЛЯ ДЕТЕЙ № 3	http://www.spr.ru/hamovniki/tsentr-vosstanovitelnogo-lecheniya-dlya-detey-3.html
ЦЕНТР ВОССТАНОВИТЕЛЬНОГО ЛЕЧЕНИЯ ДЛЯ ДЕТЕЙ № 7	http://www.spr.ru/hamovniki/tsentr-vosstanovitelnogo-lecheniya-dlya-detey-7.html