Если хотите, чтобы вас обобрали
Если вы хотите, чтобы вас ОБОБРАЛИ, поставили неверный диагноз, обманули и ничем не помогли - идите в поликлинику Семейный доктор! Во многих мед. центрах случаются неприятные казусы, но в таком количестве как тут, вы их нигде не получите!
Верно пишут люди, там зарабатывают. Врачи даже не думают, с чем вы пришли – их основная задача послать вас на как можно большее количество анализов, чтобы вы больше отдали денег.
Я проверила на своем опыте, и, что удивительно, не 1 раз, а целых 2! То есть одного раза мне было мало – я пришла туда второй раз. Просто поликлиника на бульваре Генерала Карбышева находится рядом с моим домом, вот я туда для экономии времени и обращалась.
Первый раз это было более года назад. Я обращалась к гинекологу. Он довел меня до трясучки и слез угрожая последствиями того, чего у меня не было, и, уговаривая сделать прививку на случай, если «это» все-таки случится. Прививка стоила 30 000 рублей. Слава богу, в тот моменту меня не было «лишних» 30 000 рублей. Потом я была у другого врача и оказалось, что делают прививку детям школьного и дошкольного возраста. Я, к слову, давно из этого возраста вышла. То есть врачу было главное выкачать деньги, а, что прививка бесполезна – это не важно.
Во второй раз я пошла туда к аллергологу. Случай ВОПИЮЩИЙ! Я до сих пор вспоминаю и мне просто плохо… Я потеряла 7000 рублей. На самом деле только благодаря тому, что умоляла там лора не брать с меня деньги за его пару слов, как за консультацию, а то заплатила бы еще 3000 рублей. Итого было бы 10 000 рублей.
Мне лор назначил в другой клинике расширенный анализ на аллергию, который делают с помощью надрезов на предплечье, так как у меня не проходил аллергический ринит. (к слову. Этот анализ стоит около 3000 рублей в институте аллергологии на Пушкинской). Я позвонила в СМ и мне сказали – конечно, у нас есть такая услуга – приходите!
Когда я пришла к аллергологу, оказалось, что случайно этой услуги у них нет. Какой сюрприз! Но я уже зашла в кабинет! И это уже консультация за 1500 рублей! Далее врач убедила меня, что анализ крови, который я у них сделаю, похоже то же самое, что и тот анализ на аллергены, что мне назначен. Это было грубое вранье, недостойное врача!
Она выписала мне 4 (!) направления на анализ крови и мазок из носа. За все это я отдала более 5000 рублей! Когда я пришла к лору я сразу с порога сказала, что за консультацию платить не буду, что я пришла только сдать мазок! Когда я получила результаты, где почти никаких данных по моей аллергии не было, зато оказалось, они проверили мой иммунитет (на кой черт?), я пришла к аллергологу, чтобы она расшифровала мне анализы!
Когда я вошла, она спустя 5 минут времени сказала, что анализы мне будет расшифровывать лор, так как это по его части! И сейчас вы упадете – она мне квитанцию выписала на 1500 еще! Я была в шоке! За что? Если она ничего не расшифровывала, и послала меня к лору, почему я должна платить за это 1500 рублей?? Она мне быстренько выписала бронхиальный и сказала, что это назначение лечения для иммунитета! Я отдала 7000 рублей, и не получила вообще ни разу хоть что-то похожее на то, с чем я туда обратилась!
Я сказала, что платить не буду. Мы вызвали администратора, поговорили, снова мне было сказано, что я уже сижу в кабинете, значит это консультация.
Я оплатила. Не знаю зачем, надо было просто уйти. Наверное уже там меня зажали в кабинете, надавили – вот так и вышло… Жалею – но ничего уже не поделать. Единственное. Что я могу сделать – это не ходить туда больше никогда! Кстати, лор предложил мне сделать курс уколов стоимостью около 15 000 рублей.
Я сделала эти уколы в другой клинике через дорогу (на Маршала Тухачевского «У Доктора»). Каждый укол стоил мне 400 рублей вместо 2500 рублей.
Кстати, в семейном докторе мне рассказали еще пару историй. Как мужчина хотел похудеть, пришел в СМ к диетологу и ему на 30 000 анализов назначили. А он не стал делать их и потом просто пришел к нормальному эндокринологу. Ему прописали гормоны и он похудел.
