Плохое отношение к клиентам, некомпетентные врачи, обдираловка
Купила годовой контракт, потому что до этого была в клинике и вроде все было ок. То, что в итоге оказывается, что куча услуг в контакт не входит - это ладно. Это не самое плохое в этом шаражке. Вскоре выяснилось, что к клиентам по контракту отношение на порядок хуже, чем если ты за наличные приходишь. В особенном шоке я осталась после посещения гинеколога Дыбенко Татьяны Анатольевны. Эта "врач" сразу начала меня стращать и рассказывать как все плохо, выписала сразу анализов на 15 тысяч (хотя жалоб у меня не было, просто хотела противозачаточные подобрать), она мне рада была и месячные вызвать (серьезно, таблетки прописала) и спираль поставить (нормальные врачи знают, что спирали обычно рожавшим только ставят), мне кажется, она бы мне там аборт с радостью бы сделала, а заодно и ринопластику и ногу ампутировала - лишь бы денег побольше заплатили. Очень грубая, после осмотра на инструменте осталась кровь. Особый колорит всему этому придавал ее восхитительный украинок-сельский акцент. Прочитав многочисленные отрицательные отзывы об этой докторишке, я поняла, что 15 тысяч - это стандартная начальная "такса" у нее. Кстати, если вы считаете, что спрашивать о количестве денег в кошельке - неприлично, забудьте об этих предрассудках, как мне позже объяснил ее сообщник-подельник, это нормально, и врачу необходимо знать какими суммами располагает клиент. После прочитанного (а это было в тот же день), я захотела оказаться от анализов и пошла к зам. глав врача - Потуданскому Николаю Юрьевичу. Который и оказался сообщником госпожи Дубенко. Разговаривал со мной по-хамски, иронично и свысока, перебивал, высмеивал. Все отрицал по принципу "сам дурак", сказал, что я слишком много врачей обошла по контракту и вообще должна богу молиться, что за такие копейки меня такие специалисты смотрят. На мой взгляд, это не то, что не врач, это даже не мужчина. Отбери у него надменность и неоправданный нарциссический пафос - пустое место останется. Кстати, он знает, "что за люди оставляют комментарии в интернете". Так что, у недоврача Дубенко и недомужика Потуданского сложился отличный тандем. В итоге меня отправили на прием к другому гинекологу - Бадаловой Анжелике Сергеевне. Не такой трэш, как у Дубенко, конечно, и как врач более вменяемый - опровергла большинство "диагнозов" своей коллеги и сказала, что все ок. Но вот отношение было ко мне явно предвзятое, и скрыть его у нее не получилось.
Занесла меня нелегкая к неврологу, а надо отметить, текучка у них жуткая. В общем, пару раз к нему сходила, МРТ по его наводке тоже, диск ему со снимками отдала, а он очень быстро уволился и диск мой мне никто не отдал. Пошла к другому неврологу - Константиновой Людмиле Александровне. Впечатлений, конечно, не так много, но все же. Невролог нервная и дерганая, после того, как заехала мне листком по носу и не извинилась, а я собралась идти уже к главному врачу, начала причитать и плакаться, как им там тяжко работается, денег мало платят и т. д. Вообще мне показалось, что многие врачи там ненавидят пациентов и открыто завидуют из-за недостаточной оплаты (по их мнению) их труда. Столько разговоров о деньгах я не слышала нигде, для меня это дикость.
Еще была интересная история с массажем. Делают они его чудесным средством - маслом Джонсонс Беби. Детям сразу говорят свое масло приносить, т. к. Джонсонс русского производства вызывает жуткую аллергию у большинства, а на взрослых - они ставят эксперименты. Теперь я знаю, что у меня на это чудо-масло аллергия, и, что она проходит реально долго. На мой вопрос, почему они не сменят масло, мне массажистка ответила, что многие жалуются. Но оно дешевое и руководству все равно - так в открытую и сказала.
ЛОР (не помню как зовут, молодая девушка), назначила мне подходящие антибиотики всего с 3 раза! Когда я колола ее вторую попытку, она опомнилась, что они из той же группы, что и первые и скорее всего тоже не помогут:-). Ну с кем не бывает? Ну подумаешь, я неделю делала капельницы внутривенно, потому что внутримышечный укол Цефтриаксона довольно болезненный, я уже молчу про убитую микрофлору.

Врагу не посоветую эту клинику. В принципе, я изначально знала, куда шла, потому что отзывы о ней плохие (причем, именно про 1 филиал на Воронцовской), но я решила рискнуть, надеясь, что люди сильно преувеличивают, да и конкуренты могут баловаться. Но клиника совсем рядом с домом и было удобно ходить. Выяснилось, что отзывы еще лайтовыми были: -). Ну ладно хоть не так сильно покалечили, микрофлора восстанавливается, нервы тоже.
