Благодарность Быковской, сотрудникам Евро-клиник
В Евроклиник очень хорошо!
Делали эко здесь у Быковской О. С.
Оксана Сергеевна, спасибо!
ОГРОМНОЕ ВАМ СПАСИБО за чудесную дочку!
Почитав на сайте об услугах и специалистах Евроклиник- сразу же определились, что поедем именно в эту клинику, именно к Оксане Сергеевне! И ни сколько не ошиблись в своем выборе!
Мы живем очень далеко от Москвы и потому я записалась заранее. По телефону девушка с ресепшн мне все подробно рассказала. Приехав на прием, сразу предупредили Оксану Сергеевну о том, что ограничены мы во времени (работа мужа), она сказала, что все успеем!
Сразу же приступили к лечению и подготовке к эко!
Так как я приехала не со всеми необходимыми анализами, некоторые сдавала в Евроклиник, проходила там же и специалистов (очень понравился Мамолог). Все осень быстро и удобно!
Да и сама по себе клиника очень хорошая! Палаты комфортные!
Оксана Сергеевна Профессионал своего дела! Сразу же настроила на положительный результат!
Так и вышло! Звонила я Оксане Сергеевне постоянно: и в выходные, и в праздники! И вернувшись в свой город я получала от нее консультации!Можно даже сказать, что она на огромном расстоянии вела мою беременность!А я в свою очередь, четко следовала ее инструкциям))))) и вот, все получилось!
Родила чудесную девочку!
Спасибо Вам!
P. s. прошло уже пол года и мы с мужем думаем о том, что нашей девчуле нужен братик или сестричка!) ))))
