Неоправданные ожидания, плохой сервис
Была в клинике ДНК, 2 раза на УЗИ по беременности. Клинику выбирала рядом с местом работы.
УЗИ на 33 неделях - врач, явно раздраженная личными проблемами, настойчиво распрашивала о данных предыдущих УЗИ. Зачем спрашивается, чтоб переписать? Пыталась хамить и навязывать свое мнение по вопросам ее некасающихся. Во время УЗИ в кабинет забежала постороняя женщина. Вела себя беспрардонно, пялилась, громко рассказывала новости.
Короче остались неприятные ощущения.
Лист обследования не оформлен должным образом без печатей.
Девушки с ресепшн - даже не сказали досвидания.
За платные услуги, хотелось бы получать более внимательное и дружелюбное отношение.
